,Dates,ratings,countries,flight_class,reviews
24,29th March 2023,8,Vietnam,Solo Leisure,"✅ Trip Verified |  Kigali - Nairobi - Entebbe return 26-27 March 2023. Aircraft were narrowbodies. The first flight was on a B737, while the three remaining flights were on E190’s. All four (short-haul) flights were on time. This was a Mileage Run to retain my Flying Blue gold status as it otherwise was going to expire by end of the month. I was at first travel attempt denied boarding and my ticket was suspended by a junior staff in Kigali. They said, upon liaising with Immigration I Airport, that my reason to travel was not valid. I tried to change purpose, but the damage was done, which forced me to postpone the entire trip. However, later I had the ticket reissued by KQ town office in Kigali, who were professional and committed to help without any payments as it was not a No Show case. They even took over the booking from my travel agent which was effective and great relief avoiding potential additional costs. I even got a much better (and more expensive) itinerary avoiding night-flights though extending my transit lounge stays. While the junior KQ staff in airport should be sacked for denying me boarding, the KQ staff at town office should be praised and rewarded for constructive and expedite provision of resolutions and quick ticket reissue by ignoring and avoiding the OTA. The rescheduled trip went fine in all aspects. Lounge access accommodated prior to all 4 flights, and the lounges are all of good and solid quality. Slept fine in Pride Lounge in Nairobi where I spent an eve and a night. Effective boardings/deboardings by either bus, on foot, or by jetbridge. Onboard, welcome champagne available on all four flights. I had prebooked seat 1A which was given me throughout. I preordered my favorite seafood meals which were delivered and tasty. The sole exception was a morning flight, where they could not manage my seafood, despite it appeared in their flight manuscript; not a big issue, but they apologised. KQ always manage special meals effectively; this is really a perk that not even legacy carriers like Qatar Airways or KLM allows for. The crews on all flights were fine, professional, caring, and in good mood. The food is getting better on these regional flights, and I had my tasty hot mini-meals served throughout. Hot towels provided. Nut mix were provided as snacks provided to assist on drinks, which were served several times. The challenge of my trip was the seemingly unusual turn-around in EBB to which airport staff were confused as I instantly returned to my origin without going landside. They allowed me not to buy a transit visa, and escorted me to transfer security and thereafter negotiated excessive spending time in lounge for me – I was granted full access for 7 hours though the airline agreement was only 3 hours. Onboard, no IFE and no WiFi which is fine for short flights. No luggage/baggage issues. Flying Blue status respected and some SkyPriority entitlements were given. E.g. priority boarding. Recommended. Will fly them again. Would have given 10/10 but have to deduct a bit for denied boarding initially by the junior, incompetent staff member in Kigali airport."
25,28th March 2023,1,United States,Family Leisure,"✅ Trip Verified |  This review is regarding Kenya Airways customer service and has nothing to do with the details of a specific flight. Our return to Chicago was cancelled when the KA pilots went on strike. My family of four was left to arrange alternate flight arrangements by ourselves and our travel agent who was back in Chicago. We absolutely received no help from anyone at KA. Finally got economy class tickets with Turkish Air which we took from Nairobi to Istanbul and home to Chicago. Had to pay for those tickets and was told to wait for a refund of the return with KA for our cancelled business class tickets. As it turned out, we had to wait a while for our refund which finally arrived on Feb 27. The refund was issued for almost $1200 each ($4800 for the four of us). While this may sound fair, please consider that we paid a total of $14,647 for our four business class round trip tickets to Nairobi and back. Additionally, we had to pay for our return via Turkish Air at a total of $6356. So the refund represented less than 1/3rd of the cost of the original round trip tickets. We were hoping for some consideration of the cost we incurred with Turkish Air, which ultimately was caused by KA. Following a recommendation from the CEO of KA I was contacted by one of his subordinates. While, I do believe that this individual may have had some impact upon the processing of the refund, I disagreed with him on numerous occasions when he and his staff tried to explain the refund policy to me following disruptions in service. The following is a direct quote from his email to regarding these situations: “In the event of disruptions such as the strike, the airline makes arrangements to carry you at the earliest opportunity on one of our scheduled services or reroute you to the destination shown on the ticket by our own services or those of another carrier at no additional cost to you. Should the alternative flights not be suitable or we are unable to rebook you to an alternate flight, you are entitled to a refund of the value of the unused portion of your tickets.” I contended to him that neither myself nor any member of my family was approached by anyone from KA to reroute us OR that anybody at the KA desk was willing to assist us make alternate flight arrangements. I was particularly incensed when I read the words in red, stating “…at no additional cost to you.” I feel lied to and disrespected by Kenya Airways in their addressing our significant and inconvenient disruption of service. I have found examples of other travelers on our flight similarly affected by the strike who had desk clerks reroute them with no additional out of pocket expenditure. The positive feelings I had about Kenya Airways prior to leaving Africa have been replaced by a lack of trust, a vow to never fly KA again, and to pursue informing all travelers I can to be aware and leery of KA’s management of refunds and its ultimate care and respect for passengers."
26,26th March 2023,1,United Arab Emirates,Economy Class,"✅ Trip Verified | On the Nairobi to Addis Ababa leg of my inbound flight from Dubai to Addis Ababa on March 16, 2023, our flight KQ402 was supposed to depart at 17.00 but finally after a very long and painful waiting we boarded the plane at 23.00pm! Imagine arriving from Dubai at 7.00am and waiting all day long and all night and add to this no cooperative staff and zero services! To add insult to injury, again they did it on the return flight! Apparently, delayed flights are a norm in this airline. Our flight KQ310 on 26 march was delayed by almost 2 hours. Similar things happened to me on my previous flights on this Airline, I wouldn’t even rate them with a single star, but there is no option with zero star!"
27,24th March 2023,1,United Kingdom,Economy Class,"✅ Trip Verified |  Schedule for 18.40 , delayed still waiting at the boarding gates time now 22.03. I asked them to arrange taxi from Mombasa Airport to Mombasa town. They refused. Worst airline. Even flew from Heathrow on 20th upgraded the seat with €100.00. When boarding the plane they given the seats two passengers at the same. I had to seat in ordering seats. Stay away from Kenya Airways"
28,17th March 2023,1,South Africa,Economy Class,"✅ Trip Verified |  Had 3 hours delay at the airport in Kenya and what was funny was to be told they cannot trace where the plane was but it was already in the country. Asking them that they need to send a message for my connection flight that there will a delay, they advised that they will send and email. Upon arriving at OR I was told there is nothing they can do and there was no email sent and they just need to book accommodation and in the morning I will have to come back to the office to meet their manager. They could not assist and had to buy a new flight for the missed connection flight as they did not take responsibility knowing that I missed the connection flight because of their delays. At the booked hotel, were told that was a daily occurrence with Kenya Airways, they have 10 or more people booked because to those delays. They have less planes and need to use same plane when it lands."
29,15th March 2023,3,United Kingdom,Economy Class,"✅ Trip Verified |  I am very disappointed about Kenya Airways. No tea or coffee on any of 4 flights I had with them. Ended up with most humiliating customer service representative in Nairobi Airport. She threatened not to let me on flight if I did not show her my EU settlement status. And this is at the boarding gate after passport control! My partner showed his passport and boarding pass to another representative and was let through with no questions. Some French people were told to go away and come back in 40 minutes, as I was still standing there trying to get Internet working and figuring out how to get my prove of EU settlement status, which I don't need to fly to London anyway if I am EU citizen. Avoid this airline whenever possible."
30,15th March 2023,1,Zimbabwe,Economy Class,"✅ Trip Verified |  From Harare it was delayed by two hours meaning we were suppose to miss our connecting flight in Nairobi but was assured to get another flight. Upon arrival discovered the flight was cancelled. We were put in hotels for the airport were we only slept for 1:30 mins. There was chaos to get our passport back when we returned to the airport, was rebooked for Paris now with a 6 hour layover in Paris (previous had 2 hours for connecting flight). When about to board the flight was delayed again by 1 hour."
31,14th March 2023,1,South Africa,Economy Class,✅ Trip Verified |  I flew Kenya Airways to travel to Dubai for a conference on the 4th of December 2022. My luggage was delayed and as such was not available when I landed in Dubai on the 5th December. As such I needed to incur expenses to purchase clothing and undergarments in order to be able to attend the conference. My luggage was returned to me on the 6th of December. I submitted a claim for my expenses to customer care at Kenya Airways on 12 December. I have yet to receive any assistance from the airline to date despite following up multiple times. The only feedback that I have received is receipt of my email and advice that they have escalated my claim. I will NEVER travel Kenya Airways again and would not advise anyone to travel via this airline either.
32,5th March 2023,1,Nigeria,Economy Class,"✅ Trip Verified |  I had the most horrible flight experience with Kenya Airways and no compensation for delays and lost luggage. My flight from JHB - Lagos on Thursday 1/03/2023 was delayed for nearly 3 hours in Johannesburg. I missed my flight from Nairobi to Lagos. Because I had a flight to catch to Berlin I jumped into Accra flight and from from there paid for Lagos flight. In spite of the delay and trouble going through Ghana, and extra cost I wasn’t prepared for. On getting to Lagos, my baggage/luggage is missing. I needed my baggage to travel to Berlin. "
33,25th February 2023,1,United Kingdom,Economy Class,"Not Verified |  Paid for a flight at the airport to fly out shortly after, only to be immediately put on standby because they overbooked the flight. When asking for full refund, they hold $5000 for 45 days (and still not received) and only offer of refund was with a no show fee deducted, despite being at the airport when making the booking! Frankly unacceptable behaviour and no urgency to refund in full. Strongly advise to never book with this airline!"
34,25th February 2023,1,United Kingdom,Business Class,"✅ Trip Verified |  Boarding and seating was fine. First flight was in what I would call premium economy, whereas the second flight was in, albeit tired, in business class. The food was not very much what I would call “pride of Africa” standard but the attendants were very helpful. I was very concerned when we were sprayed with a very noxious smelling substance - 8 canisters held by two attendants. Without any prior warning or consultation. The contents of these canisters was not revealed to me even though i asked. I am on day 7 of feeling very ill with breathing trouble and eyesight and diarrhoea. I attribute this to the 3 episodes of being sprayed - once on the first flight, then again while stationery at Victoria falls by crew with big spray containers and hand sprays as you would do in a field (or should not do). Then again after departure from Nairobi. The food was mediocre to poor. I’d hate to think what the economy class food was like if this was business class. My seat in the first plane could not recline and the seat in the second one struggled to go up or down. Well I certainly would like to know what we were sprayed with and how we were not informed thereof."
35,22nd February 2023,10,United Kingdom,Solo Leisure,"✅ Trip Verified |  
On time departure, excellent in flight service on both sectors. Full meal and bar service including an excellent French champagne. In all, a great trip and an excellent start to my visit to Zanzibar."
36,18th February 2023,8,United States,Solo Leisure,"✅ Trip Verified |  On Jan 27th, i flew from JFK via Kenya airways with a layover in Nairobi, continued with a flight from Nairobi to Johannesburg, final destination Capetown. In the interim I was not able to to retrieve my luggage in Johannesburg, apparently lost in transit. Spoke to a representative from Kenya Airways, Jum,  who took all of my information & my number. He kept me informed regarding the status of my luggage & before I boarded my flight to Johannesburg. He was able to locate my luggage & as promised it was there at my final destination. I just wanted to thank him again for his service & diligence in helping to resolve my dilemma. They need more people like him in public service."
37,13th February 2023,8,India,Economy Class,"✅ Trip Verified |  After booking my ticket I was very much afraid of all the negative reviews I have read. But fortunately I had a pleasant flight. Both flights departure was on time. Luggage was received in good condition. Only thing that can be improved, may be the food. Some extra items can be added."
38,12th February 2023,1,United Kingdom,Economy Class,✅ Trip Verified |  They misplaced my bag. I filled a form at Heathrow airport and that was it. I waited for days for calls nothing until I finally found their UK line and i called them and they kept telling me to hold on. Eventually they sent a bag but it was another person’s bag. I called that my should be brought and the other be returned. I told them I wouldn’t release the bag until my bag is sent and i am not comfortable with having someone’s property with me. Then i was told the true owner of the bag is in Dubai and my bag is with them at Nairobi and a “picture” of a wrapped bag (I didn’t wrap my bag) was sent. Another 2 weeks and nothing has been done again. Customer service is totally rude this time. Kept complaining to them that all my clothes are in that bag and I have no winter cloth to wear here but they aren’t even ready to help
39,21st January 2023,1,United Kingdom,Couple Leisure,"✅ Trip Verified |  Horrible first time experience. Travelled from London on 19th January to Nairobi transiting to Ghana. Before that they changed our departure time from Nairobi to 30mins late. As if that was not enough, we got to Nairobi at about 9pm after being delayed at Heathrow only to be told our flight had been delayed again for another 6hours. Instead of leaving at 10pm, we were to leave at 4am. No communication, and not even a rep to speak to another airport in Nairobi, which is their headquarters. No body cared about us and all a lady could say it, we will give you hot food. Such a horrible experience, to just sit at the airport for 6hours, after an 8and half hour flight with no place to freshen up, and then instead of leaving at 4, we left at 4.50am. No apologies from anyone. Now I am dreading my return journey. I will not take this airline again and will certainly not recommend to any one. Shame to treat other Africans as 2nd class citizens and yet call yourself the pride of Africa. Maybe it’s time to change that name not befitting your poor services."
