,Dates,ratings,countries,flight_class,reviews
0,30th August 2023,3,Democratic Republic of the Congo,Economy Class,"✅ Trip Verified |  It is truly distressing for such a large company to see a total lack of respect and communication towards customers. I don't know if this is the case for other destinations outside the DRC, Kinshasa but the service is really disappointing. No luggage received and that, without any explanation or apology. Out of a total of 11 suitcases, none arrived and we then have to run after the company to get crumbs of information if the person receiving is willing and in the mood. The lack of consideration from customers is really disappointing, it's sad to see that the Pride of Africa slogan is only limited to the paint on planes and in advertising spots.  Il est vraiment désolant pour une compagnie aussi grande de constater un manque total de respect et communication envers les clients. Je ne sais pas si c'est le cas pour d'autres destinations en dehors de la RDC, Kinshasa mais le service est vraiment decevant. Aucun bagages reçu et ça, sans aucune explication ni excuses. Sur un total de 11 valises, aucune n'est arrivée et nous devons par la suite courir derrière la compagnie pour avoir des miettes d'informations si la personne qui reçoit est disposé et d'humeur. Le manque de considération des clients est vraiment decevant, c'est triste de voir que le slogan de Pride of Africa ne se limite qu'à la peinture sur les avions et dans les spots publicitaires. "
1,28th August 2023,3,United Kingdom,Business Class,✅ Trip Verified |  Dreadful airline - after emailing customer service to say both my wife and I had no entertainment system as both were broken and then no choice of food as they had run out - customer service totally uninterested and not replied. Had our money and don’t care Avoid
2,26th August 2023,2,South Africa,Economy Class,"Not Verified |  The lady at check-in was very rude and insisted on wanting to check in my colleague on a 4am flight with no alternative accommodation but a mere 200usd and we  rejected the offer as it excluded accommodation. She refused to call the manager when we requested her to and brazenly carried on until we confronted her again. Only after waiting for 55 minutes then my colleague's seat was secured and we went through the boarding gates. As if that wasn't enough, the departure time was 30min late and no apology was received from the captain. To use Kenya Airways was the biggest blunder on my side ever committed. I am a frequent flyer and have never experienced such a distasteful and shabby treatment ever. I vow never to use this airline again."
3,23rd August 2023,3,United Kingdom,Family Leisure,"✅ Trip Verified |  Dismal from start to end. Not all of the staff and crew were rude, some were just sullen and disinterested. Food was consistently awful, drinks were ok. The hard product isn’t too bad (similar to what Turkish used to operate, i.e. dated, but comfortable enough), but everything else was dreadful - checkin, lounges, boarding etc, all service points were very poor. Nairobi airport was an awful experience all 4 times (we had stopovers in both directions), expect corruption, chaos and disorganisation. I’ll do all I can to avoid Kenya Airways in future."
4,22nd August 2023,1,United States,Economy Class,"Not Verified | Airline was 1 hour late to board passengers and to 1 hour late to depart without any explanation. Food was horrible, and to make matters worse, they lost the entire passengers' luggage without any explanation. The Swiss Port employee who was left to deal with the passengers had no clue what was going on and all he could do was give us forms to fill out. All perishable items that I carried will now be trashed since the man said the earliest we could get our bags is Wednesday 8/24. A passenger on the same flight who had air tagged her luggage indicated that the bag was still at JKIA! Last month they also lost my husband's luggage and when they tracked it, it was discovered to be at the Delta baggage office still in New York instead of Kenya. 4 days later when it was delivered. They did not even bother to refund us."
5,19th August 2023,2,Uganda,Economy Class,"✅ Trip Verified |  Kenya Airways has really disappointed me for a second time, it's never on time, it appears 30_40 minutes late. Am supposed to be setting off to Uganda from Kenya but the plane is not even here. Same applies from Dubai we left 26 minutes late that was even before we boarded. "
6,18th August 2023,8,Vietnam,Solo Leisure,"✅ Trip Verified |  JNB-NBO-AMS-ZRH on 14-15 August 23. Flights on time, despite being quite full. Good announcements. Check in on transfer desk in Jo-burg, all 3 BPs issued on spot. Kenya now uses the South African Airlines lounge, which is very high class lounge with sleepers and a very diverse buffet with high quality foods. The long haul flights were both on Boeing 787-9, business class is wonderfully furnished, spacious, in 2x2x2 configuration which is perfect. Low chair fenders allow you to overlook entire cabin when seated upright. Very ample leg space in the lie-flats. Spent night in Pride lounge, Nairobi. Preordered, hot seafood meals were provided thrice on the two flights, all different variants and tasty. Take-off champagne given. Not the most sublime business class catering in the skies: food in general is not extraordinary (apart from the pre-order options), no beer choices, only the watery national Tusker Lager offered. Meals robust and reliable, pre-ordered meal managed well. FAs active and smiley, though not well coordinated, despite being many. IFE is acceptable though narrow choices on movies. Nice beds with mattresses and pillows, 2 blankets per seat. Will fly again with KQ. KLMs 52 lounge in Amsterdam is huge and good, they printed out coming Boarding Passes for me. Amsterdam-Zurich on Embraer 190 aircraft operated by KLM, well synchronised with Kenya Airways and under their flight number. Flight full. Delayed ½ hour due to complicated, tedious loading of two giant dogs, a serious unnecessary delay causing delay for 200 people. Catering was surprisingly good: menu card, nice, large food box with 3 course meal, including my favoured seafood meal. Champagne, 4 wines, and lots of hot and soft drinks offered. Swift service. Seats are just economy seats but I was given 2 seats in front row and can’t complain."
7,7th August 2023,1,South Africa,Economy Class,✅ Trip Verified | Officially the worlds worst airline. 3hr + delay from SA to Burundi and coming home they call you to board and then tell you your flight is delayed by 2hrs+. No compensation. Rude cheeky staff with no customer service. They try to push the blame to customers and have a serious attitude issue. Everything about the airline is so disappointing from the aircraft to the meals to the staff to the compensation. Been on the airport for more than 10hrs. No empathy for ppl. They tell you to book a hotel at your own expense and they can’t even accommodate ppl in lounges. Pathetic. Stay away from this airline.
8,31st July 2023,1,United Arab Emirates,Economy Class,"Not Verified |  The worst service I have ever encountered in airline, my fiancé missed her flight 4 times due to overbooking of airline. Airport workers keep on sending her back home saying that the airplane is full, I wonder how if you can treat your staff like that? How can you put up to 7 passengers waiting for more than 4 days or why would you issue staff tickets yet you know the plane is full? 30 minutes Before the gates closes the we can see that you can even issue tickets, the flight has up to 10 seats free and still you decide not to give your staff a seat? I do not ever recommend anyone to use Kenya airways"
9,27th July 2023,1,United Kingdom,Economy Class,"✅ Trip Verified | Do not use Kenya Airways! This was the worst decision I’ve ever made, I had two flights one from Mombasa to Nairobi which was delayed 4 hours so I almost “missed” my second flight home to London then I got there and they delayed it by an hour meaning it was 12:55pm then they told us they were delaying it till the next day at midday. The organisation was appalling. Got to a hotel room at 4am which wasn’t cleaned at all and they didn't even give me a key card for my hotel room. The flight then also got delayed another 2 hours the next day."
10,22nd July 2023,1,Oman,Economy Class,✅ Trip Verified |  I had the worst experience with them I cant even explain my frustration. The night of my departure they told us 2 hours delay then another 3 hours then they said you know what it's cancelled. They booked me another flight the next day I reached to Dubai and the next flight was already gone by then. 
11,8th July 2023,1,South Africa,Economy Class,"✅ Trip Verified |  We travelled from Mauritius to South Africa, with a connection flight in Nairobi. In Mauritius we've checked in all 3 of our bags at the same time. Upon arrival in Johannesburg, South Africa, we were informed that my son's bag stayed behind in Mauritius. They've done a tracking on the barcode, and informed us that the bag never arrived in Nairobi either. How can you just leave the bag behind? Pathetic service!"
12,6th July 2023,1,United Arab Emirates,Business Class,"✅ Trip Verified | 
We had flown in from Dubai to Nairobi on Business class and it was good. Hence on our way back I decided to upgrade and fly business class, expecting the same. It was the biggest mistake in my life. The so called business class was just close to the premium economy of most other airlines. Seats had some push back and that's it. The leg extender was stuck and won't extend. Cabin crew said they were helpless - they didn't even try to see if it can be worked. I had to spend the entire flight sitting upright cos without the leg extender to support, I was slipping down if I reclined the seat. Horrible experience and to top it all there event wasn't a TV on the 5 hour 20 minute flight. Cabin crew said that this aircraft only has so much facility and they were looking at each other and smiling when they heard that I actually upgraded to business class. I would like to know how I can claim a refund. Where and how can I escalate this matter to. I sent a dm on Twitter to the airline which they haven't responded. Such daylight robbery must not be permitted. This isn't the upgrade we pay for. I am going to share my horrible experience on all social media channels. Interestingly I have not received any survey about my flight experience, which they promptly send. Never flying Kenya Airways again."
13,4th July 2023,3,South Africa,Couple Leisure,"✅ Trip Verified |  One of the worst airlines I travelled on. KQ765 delayed out of JHB with no reason given only left at 02:30 on Sunday morning 25 June in stead of 01:15. Missed our connection flight out of Nairobi to Zanzibar. Ground staff made us wait for 3 hours before we got any assistance in Nairobi. Eventually got a Precision flight to Zanzibar after we had to fight the staff for seats. We were assured that the flight will have our baggage on it as it was scheduled to leave 3 hours after we got our seats. When we arrived in Zanzibar we had no baggage and the ground staff was rude saying it was not their fault we did not have our baggage and that it would be at the Zanzibar airport on Sunday evening with the next flight and if we want it we can come fetch it then. We where on honeymoon and our Hotel is 1 hour 20min away from the airport, as we booked a all inclusive package which included our transfer to and from the hotel, we had no means to get back to the airport to collect our bags. We requested that they please deliver the bags to the hotel. Ground staff said they can only deliver on Monday morning. When we asked for compensation to get some necessities like toothbrush and clean clothes, as we had no clothes or toiletries and had a dinner reservation for Sunday evening, we were told it is not their problem nor their fault our baggage did not arrive and they rushed us out of their office. Needless to say we did not receive our baggage that evening. Monday morning 26 June I phoned the lost baggage office and was told the delivery will only start work at around 10:00 and would need to make a few stops before he gets to us. We ended up getting our baggage at 15:00 Monday afternoon. Missing the whole Sunday and most of Monday of our vacation because of having no clothes."
14,3rd July 2023,1,Kenya,Economy Class,"✅ Trip Verified |  No where near does this airline come to being called the pride of Africa, it has made us as Kenyans embarrassed. The flight itself delayed for over 4 hours with no valid explanation nor any compensations. No regrets no apologies. The cabin crew are probably the rudest you'll ever come across as if they are doing you a favor. No courtesy and concerns for the three infants and 1 elderly I was traveling with on the contrary we were begging for the very basics and still not provided, like infant food! Inspire of pre-arranged meals non of my infants got the baby meals. The aircraft they are using is not for long distance international flights as the seats are extremely compact and zero legroom. We came out of the flight tired and exhausted as if we had been in war. Ground crew at both the airports equally the same and no sense of responsibility. Check in experience, 1.5 hours just to check in my family of 5 adults and 3 babies. How in the world can you explain this? Cabin smells stale from previous flight and nothing fresh. This is the worst airline I've ever travelled in."
15,1st July 2023,1,South Africa,Economy Class,"Not Verified |  Never use this airline, original flight had a 2 hour layover. It was canceled and the new flight had a 8+ hour layover. Nowhere comfortable to sit as the don't give you access to the Pride Lounge but only a food voucher with no food selection but a set meal. Staff have a terrible attitude and not bothered to help. I will never use this Kenya Airways again."
16,30th June 2023,9,United Kingdom,Economy Class,"Not Verified |  The flight on return journey was excellent. A sumptuous fish menu provided on my return yesterday. Staff are caring and lovely to talk to. I watched a cookery show and learnt a recipe on flight. Also a construction show though took it off half way due to the swearing. There wasn't much to watch for me but I left happy learning a potato recipe from South Africa. A bit of a delay in Nairobi for an hour but as I was on holiday it didn't spoil any plans. I spoke to a lady going to USA and she was given accommodation for missing connecting flight. So not so bad. My issue seems mild but one that all schools are aware of in London. We had a nut snack and I did hope that those with nut allergies where considered. At my children's 3 schools, we simply remove nuts from children packed lunch or school dinners and from view as some people get very bad allergies. Maybe it was the type of nuts served but I was surprised to see nuts on the menu."
17,25th June 2023,10,Kenya,Economy Class,"Not Verified | My family of 4 people had booked to fly from Glasgow to Nairobi thru Amsterdam on 26 th June 2023. As they were preparing to fly, they received a message that the flight from Glasgow to Amsterdam is cancelled. Thus the re-booking is done for 2 people on 26 th and the other 2 on 27 th June. That would have messed all our onward plans. As today is a Sunday, we never got any response from the agent in Scotland who booked the tickets. As a last resort, with a prejudiced mind that I am just gambling, I called Kenya Airways number. The response I received was absolutely amazing. We got re-booking from Edinburgh to Amsterdam to reach Nairobi as planned earlier. I am really thankful."
18,20th June 2023,2,Denmark,Economy Class,"Not Verified |  I had booked a return flight from Copenhagen to Mombasa and back. Unfortunately I missed my connecting flight going to Mombasa. I booked another flight to Mombasa and I immediately contacted Kenya Airways customer support to find a solution for my return flight. I wrote and called them for a week before I heard back from Kenya Airways. Fortunately the reply was (in writing) that my return ticket was confirmed. When I went to Mombasa airport to fly back they could not find my ticket. I showed them the email with the confirmation and the Kenya Airways lady in Mombasa agreed that it said my ticket was confirmed. Head office refused to let me onboard unless I purchased a new ticket. I did so to come home to my family and I was advised to contact customer service when I got back to get my money back. Then followed several months where I have been writing with Kenya Airways Customer Support. All sort of excuses came up claiming I had the wrong visa, to me being a student and other lies. Finally they concluded that in reality I had not purchased a new ticket, instead I had paid a penalty fee for missing my original flight. I then provided Kenya Airways with a copy of my receipt from Mombasa airport that clearly states that I had to my a new ticket. Since then Kenya Airways have ignored my emails. I am really shocked how Kenya Airways has tried to avoid taking responsibility and done so by lying, bullying and inventing stories to make me drop my claim. I followed every procedure the moment I missed my plane and I truly trusted and believed Kenya Airways when they wrote me that my ticket was confirmed. The lesson learned is apparently that you cannot trust Kenya Airways."
19,8th June 2023,1,United Arab Emirates,Economy Class,"✅ Trip Verified |  I have been flying with Kenya Airways for the past 6 years, experienced a delay once which was okay but I had the worst experience in May where both trips were a disappointment. First, on the 14th May my Departure was delayed from 6am to 4pm. No apologies nothing, they kept on rescheduling the flight without proper communication. We late boarded Emirates to Nairobi. Again it took us hours to board from Nairobi to Mombasa. I was supposed to arrive at Mombasa 11am on the 14th Sunday but we arrived 2am on the 15th Monday.Worst scenario was on 28th May, my flight was scheduled at 8:45pm to Nairobi then connecting flight at 11.45pm.I arrived on time waited on the queue reaching the counter am told my flight was rescheduled to 7pm! On the screen I could see clearly my flight displayed at 8:45pm.Seriously ! Without even sending a notification, remember while booking phone number and email address is always part of the reservation details. The staff showed no remorse and asked me to check with reservation team. I walked politely to KQ office. I was so shocked when the reservation agent told me that my ticket is not valid ,that it's just a paper - so from changing the time to my ticket being void. This was the worst respond ever! Kenya airways staff lie a lot. He even told me that they tried to send a notification of which he wasn't sure. After insisting for a whole one hour, a supervisor later checked me in and I boarded the 8:45pm flight they booked me a hotel in Nairobi and I had to board my flight at 5pm.I missed my reporting day at work .It was my last time boarding Kenya airways Such a shame."
20,3rd June 2023,2,United Kingdom,Business,"✅ Trip Verified |  At a time when many airlines are improving their product, Kenya Airways appears to be going in the opposite direction. Getting onto the aircraft in Nairobi was chaotic with no priority given to business passengers – for the airline ‘Sky Priority’ means nothing. From the boarding gate we then went on a long bus journey around the airport before returning to part of the terminal to climb up stairs to get onto the aircraft. Although the cabin crew were very pleasant and offered a pre-flight drink (champagne, water or apple juice) no more drinks were served until after the meal arrived. This was a total disappointment with my beef option consisting of two small pieces of beef, some sauce and a mini samosa. It was complemented with a glass of wine in a thimble-sized glass which was only refilled when we asked the crew. One of the mysteries of the flight was why the lavatory at the front of the aircraft permanently had an engaged light on. When we asked we were told that the captain had said that it was ‘reserved for the crew and passengers could not use it’. Another mystery was a man who spent the entire flight sat on the crew jumpseat in the middle of the business section. I asked him what he was doing and he explained that the crew ‘could not find me anywhere to sit’. Given that airlines flying into the UK have a legal obligation to provide advance passenger information 24-hours before arrival it would be interesting to know how this requirement was met. Although the aircraft was clean and the flight was smooth, Kenya Airways’ 787 are let down by their old-style side-by-side seating which was worn and, in some cases, not functioning properly. The fact that the flight was full suggests that the airline has no problem selling tickets and therefore little incentive to improve its product."
21,26th May 2023,1,United Arab Emirates,Economy Class,✅ Trip Verified |  This is a bad airline. I travelled with Kenya airways on the 20th of May 2023 and now is the 26 May 2023 and l haven't received my bag. I was told the bags were left in Kenya. I have made several phone calls to Zimbabwe and also here l have visited their office in Dubai they are not giving mey bag. This is my last time to travel with Kenya airways.
22,30th April 2023,1,Ireland,Economy Class,"✅ Trip Verified |  Missed outward leg of a return flight, due to issue with KA website. Accepted loss here, though honestly feel website more than 50% responsible. Problem was return leg automatically cancelled. Engaged from two weeks before flight with what is inexplicably called 'customer support' and still had to pay again at the last minute to get a flight back to Nairobi. Total loss considerably more than the original return flight total. Sent at least 8 messages to customer support. Initial replies reassuring and seemed to offer resolution, but nothing happened. Reassurances turned out to be misleading and the information I needed was never offered. Customer service agents, while courteous and polite, seem to assume that customers will have an understanding of the rules and practices of the dystopian KA universe. No useful information is provided. It also appears that agents do not have the authority to actually resolve anything. Therefore, they do not really engage with an issue, but dole out meaningless bland reassurances. To get a flight, it required a very long and expensive phone call with an agent who had to constantly refer to a supervisor. Thankfully there are alternatives to KA, both externally and internally."
23,1st April 2023,8,South Africa,Solo Leisure,"✅ Trip Verified |  Very good flight, excellent crew on board, as was the food and drink. My only gripe is the business class seats could do with an update, but they are comfortable none the less."
